{
  "id": "policy-target-catalog-fukuoka-prefecture-initiative-10",
  "policy_initiative_id": "policy-initiative-fukuoka-prefecture-10",
  "source_ids": ["policy-source-fukuoka-pref-plan-2022-2026"],
  "source_document_url": "https://www.pref.fukuoka.lg.jp/uploaded/life/632711_61262666_misc.pdf",
  "source_page": 4,
  "printed_page": 318,
  "items": [
    {
      "id": "policy-target-fukuoka-prefecture-initiative-10-41",
      "target_number": 41,
      "submeasure_title_original": "ウィズコロナ・ポストコロナを見据えた観光産業の高付加価値化",
      "indicator_name_original": "旅行消費単価（日本人）",
      "components": [
        {
          "label": null,
          "baseline_value": 36300,
          "baseline_unit": "円",
          "baseline_period": "R2年",
          "baseline_scope": "annual",
          "target_value": 50800,
          "target_unit": "円",
          "target_period": "R8年",
          "target_scope": "annual",
          "preferred_direction": "increase"
        }
      ],
      "actual_linkage_status": "not_linked",
      "evaluation_status": "not_assessed"
    },
    {
      "id": "policy-target-fukuoka-prefecture-initiative-10-42",
      "target_number": 42,
      "submeasure_title_original": "ウィズコロナ・ポストコロナを見据えた観光産業の高付加価値化",
      "indicator_name_original": "旅行消費単価（通常入国外国人）",
      "components": [
        {
          "label": null,
          "baseline_value": 66000,
          "baseline_unit": "円",
          "baseline_period": "R1年",
          "baseline_scope": "annual",
          "target_value": 78000,
          "target_unit": "円",
          "target_period": "R8年",
          "target_scope": "annual",
          "preferred_direction": "increase"
        }
      ],
      "actual_linkage_status": "not_linked",
      "evaluation_status": "not_assessed"
    },
    {
      "id": "policy-target-fukuoka-prefecture-initiative-10-43",
      "target_number": 43,
      "submeasure_title_original": "広域ルートの設定・新たな観光エリアの創出による旅行消費の拡大",
      "indicator_name_original": "リピーター率",
      "components": [
        {
          "label": "参考値",
          "baseline_value": 59.5,
          "baseline_unit": "%",
          "baseline_period": "R1年度",
          "baseline_scope": "snapshot",
          "target_value": 65,
          "target_unit": "%",
          "target_period": "R8年度",
          "target_scope": "snapshot",
          "preferred_direction": "increase"
        }
      ],
      "actual_linkage_status": "not_linked",
      "evaluation_status": "not_assessed"
    },
    {
      "id": "policy-target-fukuoka-prefecture-initiative-10-44",
      "target_number": 44,
      "submeasure_title_original": "デジタルマーケティングの強化",
      "indicator_name_original": "県の観光情報SNSフォロワー数（国内向け）",
      "components": [
        {
          "label": null,
          "baseline_value": 85008,
          "baseline_unit": "人",
          "baseline_period": "R2年度",
          "baseline_scope": "cumulative",
          "target_value": 200000,
          "target_unit": "人",
          "target_period": "R8年度",
          "target_scope": "cumulative",
          "preferred_direction": "increase"
        }
      ],
      "actual_linkage_status": "not_linked",
      "evaluation_status": "not_assessed"
    },
    {
      "id": "policy-target-fukuoka-prefecture-initiative-10-45",
      "target_number": 45,
      "submeasure_title_original": "デジタルマーケティングの強化",
      "indicator_name_original": "県の観光情報SNSフォロワー数（海外向け）",
      "components": [
        {
          "label": null,
          "baseline_value": 197570,
          "baseline_unit": "人",
          "baseline_period": "R2年度",
          "baseline_scope": "cumulative",
          "target_value": 400000,
          "target_unit": "人",
          "target_period": "R8年度",
          "target_scope": "cumulative",
          "preferred_direction": "increase"
        }
      ],
      "actual_linkage_status": "not_linked",
      "evaluation_status": "not_assessed"
    },
    {
      "id": "policy-target-fukuoka-prefecture-initiative-10-46",
      "target_number": 46,
      "submeasure_title_original": "デジタルマーケティングの強化",
      "indicator_name_original": "県の観光情報SNS記事閲覧数（国内向け）",
      "components": [
        {
          "label": null,
          "baseline_value": 217,
          "baseline_unit": "万回",
          "baseline_period": "R2年度",
          "baseline_scope": "annual",
          "target_value": 400,
          "target_unit": "万回",
          "target_period": "R8年度",
          "target_scope": "annual",
          "preferred_direction": "increase"
        }
      ],
      "actual_linkage_status": "not_linked",
      "evaluation_status": "not_assessed"
    },
    {
      "id": "policy-target-fukuoka-prefecture-initiative-10-47",
      "target_number": 47,
      "submeasure_title_original": "デジタルマーケティングの強化",
      "indicator_name_original": "県の観光情報SNS記事閲覧数（海外向け）",
      "components": [
        {
          "label": null,
          "baseline_value": 400,
          "baseline_unit": "万回",
          "baseline_period": "R2年度",
          "baseline_scope": "annual",
          "target_value": 800,
          "target_unit": "万回",
          "target_period": "R8年度",
          "target_scope": "annual",
          "preferred_direction": "increase"
        }
      ],
      "actual_linkage_status": "not_linked",
      "evaluation_status": "not_assessed"
    },
    {
      "id": "policy-target-fukuoka-prefecture-initiative-10-48",
      "target_number": 48,
      "submeasure_title_original": "マーケティングに基づく戦略的な国内外からの誘客・県内周遊の促進",
      "indicator_name_original": "延べ宿泊者数（日本人）",
      "components": [
        {
          "label": null,
          "baseline_value": 1616,
          "baseline_unit": "万人泊",
          "baseline_period": "R1年",
          "baseline_scope": "annual",
          "target_value": 1772,
          "target_unit": "万人泊",
          "target_period": "R8年",
          "target_scope": "annual",
          "preferred_direction": "increase"
        }
      ],
      "actual_linkage_status": "not_linked",
      "evaluation_status": "not_assessed"
    },
    {
      "id": "policy-target-fukuoka-prefecture-initiative-10-49",
      "target_number": 49,
      "submeasure_title_original": "観光人材の育成、観光組織体制の強化",
      "indicator_name_original": "観光地域づくり法人及び観光地域づくり候補法人の数",
      "components": [
        {
          "label": null,
          "baseline_value": 11,
          "baseline_unit": "団体",
          "baseline_period": "R2年度",
          "baseline_scope": "cumulative",
          "target_value": 17,
          "target_unit": "団体",
          "target_period": "R8年度",
          "target_scope": "cumulative",
          "preferred_direction": "increase"
        }
      ],
      "actual_linkage_status": "not_linked",
      "evaluation_status": "not_assessed"
    }
  ],
  "reviewed_at": "2026-07-16",
  "review_status": "reviewed",
  "confidence": "high"
}
