{
  "id": "policy-target-catalog-fukuoka-prefecture-initiative-13",
  "policy_initiative_id": "policy-initiative-fukuoka-prefecture-13",
  "source_ids": ["policy-source-fukuoka-pref-plan-2022-2026"],
  "source_document_url": "https://www.pref.fukuoka.lg.jp/uploaded/life/632711_61262666_misc.pdf",
  "source_page": 5,
  "printed_page": 319,
  "items": [
    {
      "id": "policy-target-fukuoka-prefecture-initiative-13-69",
      "target_number": 69,
      "submeasure_title_original": "結婚や子育ての希望をかなえる県民を応援する社会づくり",
      "indicator_name_original": "出会い・結婚応援事業を通じた成婚者数",
      "components": [
        {
          "label": null,
          "baseline_value": 172,
          "baseline_unit": "人／年",
          "baseline_period": "R2年度",
          "baseline_scope": "annual",
          "target_value": 180,
          "target_unit": "人／年",
          "target_period": "R8年度",
          "target_scope": "annual",
          "preferred_direction": "increase"
        }
      ],
      "actual_linkage_status": "not_linked",
      "evaluation_status": "not_assessed"
    }
  ],
  "reviewed_at": "2026-07-16",
  "review_status": "reviewed",
  "confidence": "high"
}
